{
  "collegeAndLevel": {
    "empty": "false",
    "errored": false,
    "noStudentId": "false",
    "standing": "Undergraduate",
    "level": "Senior",
    "college": "ENGR",
    "major": "Civil Engineering"
  },
  "gpaUnits": {
    "cumulativeGpa": 2.4,
    "totalUnits": 65.6,
    "totalUnitsAttempted": 55
  },
  "requirements": [
    {
      "name": "UC Entry Level Writing",
      "status": "met"
    },
    {
      "name": "American History",
      "status": "met"
    },
    {
      "name": "American Institutions",
      "status": "met"
    },
    {
      "name": "American Cultures",
      "status": "met"
    }
  ],
  "regblocks": {
    "errored": false,
    "activeBlocks": [
      {
        "status": "Active",
        "type": "FINAN",
        "blockedDate": {
          "epoch": 1366614000,
          "dateTime": "2013-04-22T00:00:00-07:00",
          "dateString": "4/22/2013"
        },
        "clearedDate": {
          "epoch": null,
          "dateTime": null,
          "dateString": null
        },
        "reason": "CARS",
        "office": "BPS"
      }
    ],
    "inactiveBlocks": [
      {
        "status": "Released",
        "type": "ACAD",
        "blockedDate": {
          "epoch": 1366527600,
          "dateTime": "2013-04-21T00:00:00-07:00",
          "dateString": "4/21/2013"
        },
        "clearedDate": {
          "epoch": 1366614000,
          "dateTime": "2013-04-22T00:00:00-07:00",
          "dateString": "4/22/2013"
        },
        "reason": "",
        "office": "LNS"
      },
      {
        "status": "Released",
        "type": "ADMIN",
        "blockedDate": {
          "epoch": 1332201600,
          "dateTime": "2012-03-20T00:00:00+00:00",
          "dateString": "3/20/2012"
        },
        "clearedDate": {
          "epoch": 1332201600,
          "dateTime": "2012-03-20T00:00:00+00:00",
          "dateString": "3/20/2012"
        },
        "reason": "STAT LAPSE",
        "office": "OR"
      },
      {
        "status": "Released",
        "type": "ADMIN",
        "blockedDate": {
          "epoch": 1296691200,
          "dateTime": "2011-02-03T00:00:00+00:00",
          "dateString": "2/03/2011"
        },
        "clearedDate": {
          "epoch": 1296691200,
          "dateTime": "2011-02-03T00:00:00+00:00",
          "dateString": "2/03/2011"
        },
        "reason": "MISC",
        "office": "OR"
      },
      {
        "status": "Released",
        "type": "FINAN",
        "blockedDate": {
          "epoch": 1296000000,
          "dateTime": "2011-01-26T00:00:00+00:00",
          "dateString": "1/26/2011"
        },
        "clearedDate": {
          "epoch": 1296000000,
          "dateTime": "2011-01-26T00:00:00+00:00",
          "dateString": "1/26/2011"
        },
        "reason": "LIBRARY",
        "office": ""
      },
      {
        "status": "Released",
        "type": "ACAD",
        "blockedDate": {
          "epoch": 1245110400,
          "dateTime": "2009-06-16T00:00:00+00:00",
          "dateString": "6/16/2009"
        },
        "clearedDate": {
          "epoch": 1245110400,
          "dateTime": "2009-06-16T00:00:00+00:00",
          "dateString": "6/16/2009"
        },
        "reason": "",
        "office": "LNS"
      },
      {
        "status": "Released",
        "type": "ACAD",
        "blockedDate": {
          "epoch": 1231891200,
          "dateTime": "2009-01-14T00:00:00+00:00",
          "dateString": "1/14/2009"
        },
        "clearedDate": {
          "epoch": 1231891200,
          "dateTime": "2009-01-14T00:00:00+00:00",
          "dateString": "1/14/2009"
        },
        "reason": "",
        "office": "LNS"
      },
      {
        "status": "Released",
        "type": "ACAD",
        "blockedDate": {
          "epoch": 1173139200,
          "dateTime": "2007-03-06T00:00:00+00:00",
          "dateString": "3/06/2007"
        },
        "clearedDate": {
          "epoch": 1173139200,
          "dateTime": "2007-03-06T00:00:00+00:00",
          "dateString": "3/06/2007"
        },
        "reason": "",
        "office": "LNS"
      },
      {
        "status": "Released",
        "type": "ACAD",
        "blockedDate": {
          "epoch": 1134345600,
          "dateTime": "2005-12-12T00:00:00+00:00",
          "dateString": "12/12/2005"
        },
        "clearedDate": {
          "epoch": 1134345600,
          "dateTime": "2005-12-12T00:00:00+00:00",
          "dateString": "12/12/2005"
        },
        "reason": "ACADEMIC",
        "office": "LNS"
      },
      {
        "status": "Released",
        "type": "ACAD",
        "blockedDate": {
          "epoch": 1133827200,
          "dateTime": "2005-12-06T00:00:00+00:00",
          "dateString": "12/06/2005"
        },
        "clearedDate": {
          "epoch": 1133827200,
          "dateTime": "2005-12-06T00:00:00+00:00",
          "dateString": "12/06/2005"
        },
        "reason": "",
        "office": "LNS"
      },
      {
        "status": "Released",
        "type": "ACAD",
        "blockedDate": {
          "epoch": 1133222400,
          "dateTime": "2005-11-29T00:00:00+00:00",
          "dateString": "11/29/2005"
        },
        "clearedDate": {
          "epoch": 1133222400,
          "dateTime": "2005-11-29T00:00:00+00:00",
          "dateString": "11/29/2005"
        },
        "reason": "",
        "office": "LNS"
      },
      {
        "status": "Released",
        "type": "ACAD",
        "blockedDate": {
          "epoch": 1133222400,
          "dateTime": "2005-11-29T00:00:00+00:00",
          "dateString": "11/29/2005"
        },
        "clearedDate": {
          "epoch": 1133222400,
          "dateTime": "2005-11-29T00:00:00+00:00",
          "dateString": "11/29/2005"
        },
        "reason": "",
        "office": "LNS"
      },
      {
        "status": "Released",
        "type": "FINAN",
        "blockedDate": {
          "epoch": 1083801600,
          "dateTime": "2004-05-06T00:00:00+00:00",
          "dateString": "5/06/2004"
        },
        "clearedDate": {
          "epoch": 1083801600,
          "dateTime": "2004-05-06T00:00:00+00:00",
          "dateString": "5/06/2004"
        },
        "reason": "CARS",
        "office": "BPS"
      },
      {
        "status": "Released",
        "type": "ADMIN",
        "blockedDate": {
          "epoch": 1074038400,
          "dateTime": "2004-01-14T00:00:00+00:00",
          "dateString": "1/14/2004"
        },
        "clearedDate": {
          "epoch": 1074038400,
          "dateTime": "2004-01-14T00:00:00+00:00",
          "dateString": "1/14/2004"
        },
        "reason": "MISCONDUCT",
        "office": "OR"
      },
      {
        "status": "Released",
        "type": "ACAD",
        "blockedDate": {
          "epoch": 1073606400,
          "dateTime": "2004-01-09T00:00:00+00:00",
          "dateString": "1/09/2004"
        },
        "clearedDate": {
          "epoch": 1073606400,
          "dateTime": "2004-01-09T00:00:00+00:00",
          "dateString": "1/09/2004"
        },
        "reason": "ACADEMIC",
        "office": "LNS"
      },
      {
        "status": "Released",
        "type": "ACAD",
        "blockedDate": {
          "epoch": 1073606400,
          "dateTime": "2004-01-09T00:00:00+00:00",
          "dateString": "1/09/2004"
        },
        "clearedDate": {
          "epoch": 1073606400,
          "dateTime": "2004-01-09T00:00:00+00:00",
          "dateString": "1/09/2004"
        },
        "reason": "ACADEMIC",
        "office": "LNS"
      },
      {
        "status": "Released",
        "type": "ADMIN",
        "blockedDate": {
          "epoch": 1021852800,
          "dateTime": "2002-05-20T00:00:00+00:00",
          "dateString": "5/20/2002"
        },
        "clearedDate": {
          "epoch": 1022112000,
          "dateTime": "2002-05-23T00:00:00+00:00",
          "dateString": "5/23/2002"
        },
        "reason": "MISC",
        "office": "OR"
      },
      {
        "status": "Released",
        "type": "ADMIN",
        "blockedDate": {
          "epoch": 1021852800,
          "dateTime": "2002-05-20T00:00:00+00:00",
          "dateString": "5/20/2002"
        },
        "clearedDate": {
          "epoch": 1021852800,
          "dateTime": "2002-05-20T00:00:00+00:00",
          "dateString": "5/20/2002"
        },
        "reason": "STAT LAPSE",
        "office": "OR"
      },
      {
        "status": "Released",
        "type": "ACAD",
        "blockedDate": {
          "epoch": 955497600,
          "dateTime": "2000-04-12T00:00:00+00:00",
          "dateString": "4/12/2000"
        },
        "clearedDate": {
          "epoch": 955584000,
          "dateTime": "2000-04-13T00:00:00+00:00",
          "dateString": "4/13/2000"
        },
        "reason": "ACADEMIC",
        "office": "LNS"
      },
      {
        "status": "Released",
        "type": "ACAD",
        "blockedDate": {
          "epoch": 922233600,
          "dateTime": "1999-03-24T00:00:00+00:00",
          "dateString": "3/24/1999"
        },
        "clearedDate": {
          "epoch": 945648000,
          "dateTime": "1999-12-20T00:00:00+00:00",
          "dateString": "12/20/1999"
        },
        "reason": "ACADEMIC",
        "office": "LNS"
      },
      {
        "status": "Released",
        "type": "ACAD",
        "blockedDate": {
          "epoch": 922233600,
          "dateTime": "1999-03-24T00:00:00+00:00",
          "dateString": "3/24/1999"
        },
        "clearedDate": {
          "epoch": 922233600,
          "dateTime": "1999-03-24T00:00:00+00:00",
          "dateString": "3/24/1999"
        },
        "reason": "ACADEMIC",
        "office": "LNS"
      },
      {
        "status": "Released",
        "type": "ACAD",
        "blockedDate": {
          "epoch": 921801600,
          "dateTime": "1999-03-19T00:00:00+00:00",
          "dateString": "3/19/1999"
        },
        "clearedDate": {
          "epoch": 955324800,
          "dateTime": "2000-04-10T00:00:00+00:00",
          "dateString": "4/10/2000"
        },
        "reason": "ACADEMIC",
        "office": "LNS"
      },
      {
        "status": "Released",
        "type": "FINAN",
        "blockedDate": {
          "epoch": 918086400,
          "dateTime": "1999-02-04T00:00:00+00:00",
          "dateString": "2/04/1999"
        },
        "clearedDate": {
          "epoch": 919123200,
          "dateTime": "1999-02-16T00:00:00+00:00",
          "dateString": "2/16/1999"
        },
        "reason": "CUBS",
        "office": "BPS"
      },
      {
        "status": "Released",
        "type": "ADMIN",
        "blockedDate": {
          "epoch": 916963200,
          "dateTime": "1999-01-22T00:00:00+00:00",
          "dateString": "1/22/1999"
        },
        "clearedDate": {
          "epoch": 916963200,
          "dateTime": "1999-01-22T00:00:00+00:00",
          "dateString": "1/22/1999"
        },
        "reason": "STAT LAPSE",
        "office": "OR"
      },
      {
        "status": "Released",
        "type": "ADMIN",
        "blockedDate": {
          "epoch": 881020800,
          "dateTime": "1997-12-02T00:00:00+00:00",
          "dateString": "12/02/1997"
        },
        "clearedDate": {
          "epoch": 884044800,
          "dateTime": "1998-01-06T00:00:00+00:00",
          "dateString": "1/06/1998"
        },
        "reason": "MISC",
        "office": "OR"
      },
      {
        "status": "Released",
        "type": "ADMIN",
        "blockedDate": {
          "epoch": 853891200,
          "dateTime": "1997-01-22T00:00:00+00:00",
          "dateString": "1/22/1997"
        },
        "clearedDate": {
          "epoch": 856396800,
          "dateTime": "1997-02-20T00:00:00+00:00",
          "dateString": "2/20/1997"
        },
        "reason": "STAT LAPSE",
        "office": "OR"
      }
    ]
  },
  "semesters": [
    {
      "name": "Spring 2014",
      "slug": "spring-2014",
      "termCode": "B",
      "termYear": "2014",
      "timeBucket": "future",
      "classes": [
        {
          "course_code": "BIOLOGY 1A",
          "dept": "BIOLOGY",
          "slug": "biology-1a",
          "title": "General Biology Lecture",
          "sections": [
            {
              "ccn": "07309",
              "enroll_limit": "105",
              "gradeOption": "Letter",
              "instruction_format": "LEC",
              "instructors": [],
              "is_primary_section": true,
              "schedules": [],
              "section_label": "LEC 003",
              "section_number": "003",
              "units": "5.0",
              "waitlist_position": "29"
            },
            {
              "ccn": "07311",
              "enroll_limit": "35",
              "instruction_format": "DIS",
              "instructors": [],
              "is_primary_section": false,
              "schedules": [],
              "section_label": "DIS 005",
              "section_number": "005",
              "waitlistPosition": "3"
            },
            {
              "ccn": "07310",
              "instruction_format": "LEC",
              "instructors": [],
              "is_primary_section": false,
              "schedules": [],
              "section_label": "LEC 004",
              "section_number": "004"
            }
          ],
          "url": "/academics/semester/spring-2014/class/biology-1a"
        }
      ]
    },
    {
      "name": "Fall 2013",
      "slug": "fall-2013",
      "termCode": "D",
      "termYear": "2013",
      "timeBucket": "current",
      "classes": [
        {
          "course_code": "BIOLOGY 1A",
          "dept": "BIOLOGY",
          "slug": "biology-1a",
          "title": "General Biology Lecture",
          "sections": [
            {
              "ccn": "07309",
              "gradeOption": "Letter",
              "instruction_format": "LEC",
              "is_primary_section": true,
              "section_label": "LEC 003",
              "section_number": "003",
              "instructors": [
                {
                  "name": "Bernadette Geuy",
                  "uid": "238382"
                },
                {
                  "name": "Chris Tweney",
                  "uid": "904715"
                }
              ],
              "schedules": [
                {
                  "buildingName": "VALLEY LSB",
                  "roomNumber": "2030",
                  "schedule": "M 4:00P-5:00P"
                }
              ],
              "units": "5.0"
            },
            {
              "ccn": "07310",
              "instruction_format": "DIS",
              "is_primary_section": false,
              "section_label": "DIS 201",
              "section_number": "201",
              "instructors": [
                {
                  "email": "scrapeit@berkeley.edu",
                  "name": "Christian Vuerings",
                  "uid": "978966"
                }
              ],
              "schedules": [
                {
                  "buildingName": "PIMENTAL",
                  "roomNumber": "1",
                  "schedule": "M 2:00P-3:00P"
                }
              ]
            }
          ],
          "url": "/academics/semester/fall-2013/class/biology-1a"
        },
        {
          "course_code": "COG SCI C147",
          "dept": "COG SCI",
          "slug": "cog_sci-c147",
          "title": "Language Disorders",
          "sections": [
            {
              "ccn": "16171",
              "gradeOption": "Letter",
              "instruction_format": "LEC",
              "is_primary_section": true,
              "section_label": "LEC 001",
              "section_number": "001",
              "instructors": [
                {
                  "name": "Bernadette Geuy",
                  "uid": "238382"
                }
              ],
              "schedules": [
                {
                  "buildingName": "WHEELER",
                  "roomNumber": "0210",
                  "schedule": "TuTh 2:00P-3:30P"
                },
                {
                  "buildingName": "DWINELLE",
                  "roomNumber": "117",
                  "schedule": "W 4:00P-5:30P"
                }
              ],
              "units": "3.0"
            }
          ],
          "url": "/academics/semester/fall-2013/class/cog_sci-c147"
        },
        {
          "course_code": "PHYS ED 1",
          "dept": "PHYS ED",
          "slug": "phys_ed-1",
          "title": "Physical Education Activities",
          "sections": [
            {
              "ccn": "72910",
              "gradeOption": "Letter",
              "instruction_format": "LAB",
              "is_primary_section": true,
              "section_label": "LAB 002",
              "section_number": "002",
              "schedules": [
                {

                  "buildingName": "HEARST GYM",
                  "roomNumber": "234",
                  "schedule": "MTuWTh 8:30A-10:00A"
                }
              ],
              "instructors": [
                {
                  "name": "Louis Pasteur",
                  "uid": "938382"
                }
              ],
              "units": ".5"
            },
            {
              "ccn": "72945",
              "gradeOption": "P/NP",
              "instruction_format": "LAB",
              "is_primary_section": true,
              "section_label": "LAB 104",
              "section_number": "104",
              "schedules": [
                {
                  "buildingName": "HEARST GYM",
                  "roomNumber": "230",
                  "schedule": "TuWTh 5:00P-7:00P"
                }
              ],
              "instructors": [
                {
                  "name": "Richard Emanuel IVES",
                  "uid": "38383737"
                }
              ],
              "units": "1.5"
            }
          ],
          "url": "/academics/semester/fall-2013/class/phys_ed-1"
        }
      ]
    },
    {
      "name": "Spring 2012",
      "slug": "spring-2012",
      "termCode": "B",
      "termYear": "2012",
      "timeBucket": "past",
      "classes": [
        {
          "course_code": "BIOLOGY 1A",
          "dept": "BIOLOGY",
          "slug": "biology-1a",
          "title": "General Biology Lecture",
          "class_sites": [
            {
              "id": "11866397",
              "shortDescription": "Confessions of a Biotician",
              "name": "BIO 1A Everyone",
              "emitter": "bCourses",
              "site_url": "https://ucberkeley.beta.instructure.com/courses/11866397"
            },
            {
              "id": "de1f491a-525e-4848-952b-11866397",
              "site_url": "https://bspace-dev.berkeley.edu/portal/site/de1f491a-525e-4848-952b-11866397",
              "emitter": "bSpace",
              "name": "Bio 1A DIS 008 Su13"
            }
          ],
          "sections": [
            {
              "ccn": "07366",
              "gradeOption": "Letter",
              "instruction_format": "DIS",
              "is_primary_section": true,
              "section_label": "DIS 201",
              "section_number": "201",
              "schedules": [],
              "instructors": [
                {
                  "name": "Bernadette Geuy",
                  "uid": "238382"
                }
              ],
              "units": "5.0"
            }
          ],
          "transcript": [
            {
              "grade": "B",
              "units": "5.0"
            }
          ],
          "url": "/academics/semester/spring-2012/class/biology-1a"
        },
        {
          "course_code": "COG SCI C147",
          "dept": "COG SCI",
          "slug": "cog_sci-c147",
          "title": "Language Disorders",
          "sections": [
            {
              "ccn": "16171",
              "gradeOption": "Letter",
              "instruction_format": "LEC",
              "is_primary_section": true,
              "section_label": "LEC 001",
              "section_number": "001",
              "schedules": [],
              "instructors": [
                {
                  "name": "Bernadette Geuy",
                  "uid": "238382"
                }
              ],
              "units": "3.0"
            }
          ],
          "transcript": [
            {
              "grade": "C+",
              "units": "3.0"
            }
          ],
          "url": "/academics/semester/spring-2012/class/cog_sci-c147"
        },
        {
          "course_code": "PB HLTH 297",
          "dept": "PB HLTH",
          "slug": "pb_hlth-297",
          "title": "Field Study in Public Health",
          "sections": [
            {
              "ccn": "78171",
              "gradeOption": "Letter",
              "instruction_format": "FLD",
              "is_primary_section": true,
              "section_label": "FLD 004",
              "section_number": "004",
              "schedules": [],
              "instructors": [
                {
                  "name": "Louis Pasteur",
                  "uid": "938382"
                }
              ],
              "units": "3.0"
            },
            {
              "ccn": "78172",
              "gradeOption": "P/NP",
              "instruction_format": "FLD",
              "is_primary_section": true,
              "section_label": "FLD 015",
              "section_number": "015",
              "schedules": [],
              "instructors": [
                {
                  "name": "Jean-Joseph Henri Toussaint",
                  "uid": "938383"
                }
              ],
              "units": "2.0"
            }
          ],
          "transcript": [
            {
              "grade": "A-",
              "units": "3.0"
            },
            {
              "grade": "P",
              "units": "2.0"
            }
          ],
          "url": "/academics/semester/spring-2012/class/pb_hlth-297"
        }
      ]
    }
  ],
  "teachingSemesters": [
    {
      "name": "Summer 2013",
      "slug": "summer-2013",
      "termCode": "C",
      "termYear": "2013",
      "classes": [
        {
          "role": "GSI",
          "slug": "biology-123a",
          "title": "General Biology and the Cambrian Biota",
          "listings": [
            {
              "course_code": "BIOLOGY 123A",
              "dept": "BIOLOGY"
            },
            {
              "course_code": "INTEGBI 183A",
              "dept": "INTEGBI"
            }
          ],
          "class_sites": [
            {
              "id": "11866397",
              "shortDescription": "Confessions of a Biotician",
              "name": "BIO 123A Everyone",
              "emitter": "bCourses",
              "site_url": "https://ucberkeley.beta.instructure.com/courses/11866397",
              "sections": [
                {
                  "ccn": "27606"
                },
                {
                  "ccn": "27619"
                },
                {
                  "ccn": "49713"
                }
              ]
            },
            {
              "id": "de1f491a-525e-4848-952b-11866397",
              "site_url": "https://bspace-dev.berkeley.edu/portal/site/de1f491a-525e-4848-952b-11866397",
              "emitter": "bSpace",
              "name": "Bio 123A DIS 008 Su13",
              "sections": [
                {
                  "ccn": "49713"
                }
              ]
            }
          ],
          "scheduledSectionCount": 3,
          "scheduledSections": [
            {
              "format": "lecture",
              "count": 1
            },
            {
              "format": "discussion",
              "count": 1
            },
            {
              "format": "laboratory",
              "count": 1
            }
          ],
          "sections": [
            {
              "ccn": "27606",
              "courseCode": "BIOLOGY 123A",
              "instruction_format": "LEC",
              "section_label": "LEC 002",
              "section_number": "002",
              "is_primary_section": true,
              "schedules": [
                {
                  "buildingName": "PIMENTAL",
                  "roomNumber": "1",
                  "schedule": "MWF 8:00A-9:00A"
                }
              ],
              "instructors": [
                {
                  "name": "Mary Salinger",
                  "email": "mary@example.edu",
                  "uid": "9898989"
                }
              ]
            },
            {
              "ccn": "27619",
              "courseCode": "BIOLOGY 123A",
              "instruction_format": "LAB",
              "section_label": "LAB 201",
              "section_number": "201",
              "is_primary_section": false,
              "instructors": [
                {
                  "name": "Mary Salinger",
                  "email": "mary@example.edu",
                  "uid": "9898989"
                }
              ],
              "schedules": [
                {
                  "buildingName": "LECONTE",
                  "roomNumber": "0004",
                  "schedule": "F 12:00P-1:00P"
                }
              ]
            },
            {
              "section_label": "DIS 008",
              "ccn": "49713",
              "courseCode": "BIOLOGY 123A",
              "instruction_format": "DIS",
              "section_number": "008",
              "is_primary_section": false,
              "schedules": [],
              "instructors": [
                {
                  "name": "Oski Bear",
                  "email": "oski@example.edu",
                  "uid": "61889"
                },
                {
                  "name": "Mary Salinger",
                  "email": "mary@example.edu",
                  "uid": "9898989"
                }
              ]
            },
            {
              "ccn": "37606",
              "courseCode": "INTEGBI 183A",
              "instruction_format": "LEC",
              "section_label": "LEC 002",
              "section_number": "002",
              "scheduledWithCcn": "27606",
              "is_primary_section": true,
              "schedules": [
                {
                  "buildingName": "PIMENTAL",
                  "roomNumber": "1",
                  "schedule": "MWF 8:00A-9:00A"
                }
              ],
              "instructors": [
                {
                  "name": "Mary Salinger",
                  "email": "mary@example.edu",
                  "uid": "9898989"
                }
              ]
            },
            {
              "ccn": "37619",
              "courseCode": "INTEGBI 183A",
              "instruction_format": "LAB",
              "section_label": "LAB 201",
              "section_number": "201",
              "scheduledWithCcn": "29713",
              "is_primary_section": false,
              "instructors": [
                {
                  "name": "Mary Salinger",
                  "email": "mary@example.edu",
                  "uid": "9898989"
                }
              ],
              "schedules": [
                {
                  "buildingName": "LECONTE",
                  "roomNumber": "0004",
                  "schedule": "F 12:00P-1:00P"
                }
              ]
            },
            {
              "section_label": "DIS 008",
              "ccn": "59713",
              "courseCode": "INTEGBI 183A",
              "instruction_format": "DIS",
              "section_number": "008",
              "is_primary_section": false,
              "schedules": [],
              "scheduledWithCcn": "49713",
              "instructors": [
                {
                  "name": "Oski Bear",
                  "email": "oski@example.edu",
                  "uid": "61889"
                },
                {
                  "name": "Mary Salinger",
                  "email": "mary@example.edu",
                  "uid": "9898989"
                }
              ]
            }
          ],
          "url": "/academics/teaching-semester/summer-2013/class/biology-123a"
        }
      ]
    },
    {
      "name": "Fall 2013",
      "slug": "fall-2013",
      "termCode": "D",
      "termYear": "2013",
      "classes": [
        {
          "role": "Instructor",
          "slug": "bio-123a",
          "title": "General Biology and the Cambrian Biota",
          "listings": [
            {
              "course_code": "BIO 123A",
              "dept": "BIO"
            }
          ],
          "scheduledSectionCount": 1,
          "scheduledSections": [
            {
              "format": "lecture",
              "count": 1
            }
          ],
          "sections": [
            {
              "ccn": "27607",
              "courseCode": "BIOLOGY 123A",
              "instruction_format": "LEC",
              "section_label": "LEC 003",
              "section_number": "003",
              "is_primary_section": false,
              "instructors": [
                {
                  "name": "Mary Salinger",
                  "email": "mary@example.edu",
                  "uid": "9898989"
                }
              ],
              "schedules": [
                {
                  "buildingName": "PIMENTAL",
                  "roomNumber": "12",
                  "schedule": "MWF 11:00A-12:00P"
                }
              ]
            }
          ],
          "url": "/academics/teaching-semester/fall-2013/class/bio-123a"
        }
      ]
    }
  ],
  "otherSiteMemberships": [
    {
      "name": "Summer 2013",
      "slug": "summer-2013",
      "termCode": "C",
      "termYear": "2013",
      "sites": [
        {
          "id": "1093166",
          "shortDescription": "Psych GSI hangout",
          "name": "Monitor Psych 1A",
          "emitter": "bCourses",
          "site_url": "https://ucberkeley.beta.instructure.com/courses/1093166"
        }
      ]
    }
  ],
  "exam_schedule": [
    {
      "date": {
        "epoch": 1387324800,
        "dateTime": "2013-12-18T00:00:00+00:00",
        "dateString": "Wed December 18"
      },
      "time": "8:00A",
      "location": {
        "rawLocation": "390 HEARST MIN",
        "display": "Hearst Memorial Mining Building",
        "lat": "37.874459999999999",
        "lon": "-122.25727000000001",
        "roomNumber": "390"
      },
      "course_code": "Psychology C120"
    },
    {
      "date": {
        "epoch": 1387324800,
        "dateTime": "2013-12-18T00:00:00+00:00",
        "dateString": "Wed December 18"
      },
      "time": "3:00P",
      "location": {
        "rawLocation": "100 GPB",
        "display": "Genetics & Plant Biology Building",
        "lat": "37.873429999999999",
        "lon": "-122.26473",
        "roomNumber": "100"
      },
      "course_code": "Psychology 133"
    },
    {
      "date": {
        "epoch": 1387324800,
        "dateTime": "2013-12-18T00:00:00+00:00",
        "dateString": "Wed December 18"
      },
      "time": "3:00P",
      "location": {
        "rawLocation": "2060 VALLEY LSB",
        "display": "Valley Life Sciences Building",
        "lat": "37.871479999999998",
        "lon": "-122.26211000000001",
        "roomNumber": "2060"
      },
      "course_code": "Education 140"
    }
  ],
  "telebears": [
    {
      "term": "Spring",
      "year": 2014,
      "slug": "spring-2014",
      "adviserCodeRequired": {
        "required": true,
        "type": "revoked"
      },
      "phases": [
        {
          "period": "Tele-BEARS Phase I",
          "startTime": {
            "epoch": 1365442200,
            "dateTime": "2013-10-13T09:30:00-08:00",
            "dateString": "10/13"
          },
          "endTime": {
            "epoch": 1365528600,
            "dateTime": "2013-10-14T09:30:00-08:00",
            "dateString": "10/14"
          }
        },
        {
          "period": "Tele-BEARS Phase II",
          "startTime": {
            "epoch": 1373389200,
            "dateTime": "2014-02-09T09:00:00-08:00",
            "dateString": "2/09"
          },
          "endTime": {
            "epoch": 1373475600,
            "dateTime": "2014-02-10T09:00:00-08:00",
            "dateString": "2/10"
          }
        }
      ],
      "url": "http://registrar.berkeley.edu/tbfaqs.html"
    }
  ],
  "lastModified": {
    "hash": "af8f7132a5d2efdf8bd3d88c2d1fa5d37086c389",
    "timestamp": {
      "epoch": 1383947240,
      "dateTime": "2013-11-08T13:47:20-08:00",
      "dateString": "11/08"
    }
  }
}
